"MLocID","StationDes","Lat_DD","Long_DD","AU_ID","MonLocType","Period","OWRD_Basin","data_period_start","data_period_end","IR_category","total_violations","max_violations_3yr","max_3yr_results_in_crit_period","total_spawn_violations","max_spawn_violations_3yr"
"BAT12","Battle Creek at Lone Oak Rd.  ",44.8611,-123.0488,"OR_WS_170900070203_02_104411","River/Stream","Year round","Willamette",2008-10-28,2017-12-15,"Cat5",550,224,277,NA,NA
"BAT3","Battle Creek at Commercial Ave.",44.8603,-123.0169,"OR_WS_170900070203_02_104411","River/Stream","Year round","Willamette",2008-10-27,2016-02-29,"Cat5",698,274,270,NA,NA
"CLK1","Clark Creek at Bush Park",44.9268,-123.0337,"OR_WS_170900070301_02_104413","River/Stream","Year round","Willamette",2008-01-11,2016-09-05,"Cat5",696,275,277,NA,NA
"CLK12","Clark Creek at Ewald Ave.",44.9012,-123.0515,"OR_WS_170900070301_02_104413","River/Stream","Year round","Willamette",2008-01-11,2016-09-01,"Cat5",254,146,277,NA,NA
"GLE12","Glenn Creek at Hidden Valley Rd.",44.9475,-123.102,"OR_WS_170900070303_02_104415","River/Stream","Year round","Willamette",2008-01-07,2016-02-29,"Cat5",74,59,195,NA,NA
"GLE3","Glenn Creek at Wallace Rd.",44.9653,-123.0579,"OR_WS_170900070303_02_104415","River/Stream","Year round","Willamette",2008-01-07,2016-07-04,"Cat5",448,224,274,NA,NA
"PRI12","East Fork of Pringle Creek at Trelstad Ave.  ",44.8853,-122.9871,"OR_WS_170900070204_02_104412","River/Stream","Year round","Willamette",2008-01-11,2016-02-29,"Cat5",896,325,253,NA,NA
"PRI3","Pringle Creek at Pringle Park",44.9341,-123.0378,"OR_WS_170900070301_02_104413","River/Stream","Year round","Willamette",2008-01-11,2017-09-19,"Cat5",948,354,268,NA,NA
"PRI3","Pringle Creek at Pringle Park",44.9341,-123.0378,"OR_WS_170900070301_02_104413","River/Stream","Spawn","Willamette",2008-01-11,2017-04-08,"Cat5",NA,NA,NA,390,183
"10688-ORDEQ","Deschutes River at Pringle Falls",43.74117494,-121.6067814,"OR_WS_170703010301_05_102282","River/Stream","Year round","Deschutes",2014-05-18,2014-09-08,"Cat2",0,0,70,NA,NA
"10689-ORDEQ","Deschutes River at Wickiup Reservoir Gauge Station",43.68612582,-121.68725,"OR_WS_170703010301_05_102282","River/Stream","Year round","Deschutes",2017-08-21,2017-12-31,"Cat2",0,0,41,NA,NA
"10699-ORDEQ","Little Deschutes River at Road 2320",43.52475709,-121.6515739,"OR_WS_170703020106_05_102338","River/Stream","Year round","Deschutes",2016-07-31,2016-10-23,"Cat5",33,33,62,NA,NA
"10703-ORDEQ","Little Deschutes River upstream of Gilchrist Mill Pond",43.4634918,-121.6979735,"OR_WS_170703020106_05_102338","River/Stream","Year round","Deschutes",2016-07-31,2016-10-23,"Cat5",33,33,62,NA,NA
"12032-ORDEQ","Mitchell Creek at SE 162nd (downstream of trailer park)",45.46017207,-122.4967473,"OR_WS_170900120101_02_104550","River/Stream","Year round","Willamette",2013-06-23,2014-11-10,"Cat5",7,7,184,NA,NA
"13141-ORDEQ","Neal Creek at mouth (upstream of bridge)",45.66386253,-121.525546,"OR_WS_170701050703_02_102007","River/Stream","Year round","Hood",2009-06-11,2011-11-08,"Cat5",9,9,276,NA,NA
"13141-ORDEQ","Neal Creek at mouth (upstream of bridge)",45.66386253,-121.525546,"OR_WS_170701050703_02_102007","River/Stream","Spawn","Hood",2010-04-12,2011-11-08,"Cat2",NA,NA,NA,0,0
"13183-ORDEQ","East Fork Neal Creek at mouth",45.59457833,-121.4990237,"OR_WS_170701050701_02_102005","River/Stream","Year round","Hood",2009-06-11,2011-11-08,"Cat2",0,0,276,NA,NA
"13183-ORDEQ","East Fork Neal Creek at mouth",45.59457833,-121.4990237,"OR_WS_170701050701_02_102005","River/Stream","Spawn","Hood",2010-04-12,2011-11-08,"Cat2",NA,NA,NA,0,0
"13184-ORDEQ","West Fork Neal Creek at mouth",45.5945686,-121.4996554,"OR_WS_170701050701_02_102005","River/Stream","Year round","Hood",2009-06-11,2011-11-08,"Cat5",7,7,276,NA,NA
"13184-ORDEQ","West Fork Neal Creek at mouth",45.5945686,-121.4996554,"OR_WS_170701050701_02_102005","River/Stream","Spawn","Hood",2010-04-12,2011-11-08,"Cat2",NA,NA,NA,0,0
"13430-ORDEQ","Hoquarten Slough at Hwy 101 (Tillamook)",45.45912869,-123.8444452,"OR_WS_171002030406_05_106217","Estuary","Year round","North Coast",2010-05-24,2010-05-25,"Cat3",0,0,0,NA,NA
"18746-ORDEQ","Eliot Branch Middle Fork Hood River, upstream of Mfid Diversion",45.45494435,-121.6378278,"OR_WS_170701050504_02_101999","River/Stream","Year round","Hood",2009-08-06,2012-08-27,"Cat5",184,161,185,NA,NA
"21811-ORDEQ","Ben Smith Creek at River Mile 0.44",45.58497307,-123.5160454,"OR_WS_171002030504_05_106117","River/Stream","Year round","North Coast",2009-07-06,2009-09-20,"Cat5",11,11,77,NA,NA
"21838-ORDEQ","Glenn Creek at River Mile 5.45",44.94748716,-123.1025499,"OR_WS_170900070303_02_104415","River/Stream","Year round","Willamette",2008-01-01,2009-04-05,"Cat3",0,0,0,NA,NA
"23526-ORDEQ","Beaver Creek at Beaver Falls Road (Tidewater, upstream of Stewart Creek)",46.11901653,-123.1642861,"OR_WS_170800030406_05_103657","River/Stream","Year round","North Coast",2017-07-05,2017-10-10,"Cat5",71,71,88,NA,NA
"23535-ORDEQ","Girt Creek at Beaver Spring Road (Beaver Creek tributary River Mile 16.6)",46.0631888,-122.9648095,"OR_WS_170800030405_05_103656","River/Stream","Year round","North Coast",2017-07-05,2017-10-11,"Cat5",20,20,88,NA,NA
"23537-ORDEQ","Carcus Creek at mouth (Clatskanie River tributary, River Mile 11.2)",46.0409906,-123.0834681,"OR_WS_170800030502_05_103659","River/Stream","Year round","North Coast",2017-07-04,2017-10-11,"Cat2",0,0,89,NA,NA
"23539-ORDEQ","Little Clatskanie River at Apiary Road (Clatskanie River tributary River Mile 16.2)",45.98796904,-123.0390707,"OR_WS_170800030503_05_103660","River/Stream","Year round","North Coast",2017-07-05,2017-10-11,"Cat5",11,11,88,NA,NA
"23888-ORDEQ","Horse Heaven Creek above confluence with Steamboat Creek",43.51122734,-122.5823311,"OR_WS_171003010701_02_105650","River/Stream","Year round","Umpqua",2017-07-13,2017-10-07,"Cat5",100,100,160,NA,NA
"24317-ORDEQ","Whychus Creek at city park in Sisters, OR",44.28798595,-121.5439889,"OR_WS_170703010702_05_102298","River/Stream","Year round","Deschutes",2008-07-03,2008-09-29,"Cat2",0,0,16,NA,NA
"24318-ORDEQ","Whychus Creek at Gaging Station above Diversions",44.23377862,-121.5672366,"OR_WS_170703010702_05_102298","River/Stream","Year round","Deschutes",2014-03-30,2017-10-15,"Cat2",0,0,93,NA,NA
"25242-ORDEQ","Jack Creek, tributary to Chetco River, just downstream of Fish Trap",42.06180384,-124.2192307,"OR_WS_171003120111_02_104697","River/Stream","Year round","South Coast",2008-07-06,2008-10-19,"Cat5",6,6,87,NA,NA
"25242-ORDEQ","Jack Creek, tributary to Chetco River, just downstream of Fish Trap",42.06180384,-124.2192307,"OR_WS_171003120111_02_104697","River/Stream","Spawn","South Coast",2008-10-15,2008-10-19,"Cat5",NA,NA,NA,4,4
"25484-ORDEQ","Maxfield Creek at Hwy 223",44.69482848,-123.4322279,"OR_WS_170900030503_02_104277","River/Stream","Year round","Willamette",2017-06-06,2017-09-30,"Cat5",46,46,92,NA,NA
"25485-ORDEQ","Price Creek at Hwy 223",44.68580005,-123.433875,"OR_WS_170900030503_02_104277","River/Stream","Year round","Willamette",2017-06-10,2017-10-08,"Cat5",52,52,92,NA,NA
"25564-ORDEQ","Little Deschutes River at Cow Camp",43.30738395,-121.8648103,"OR_WS_170703020101_05_102333","River/Stream","Year round","Deschutes",2016-07-31,2016-10-23,"Cat5",27,27,62,NA,NA
"25565-ORDEQ","Little Deschutes River upstream of Hemlock Creek",43.36064953,-121.8272492,"OR_WS_170703020101_05_102333","River/Stream","Year round","Deschutes",2016-07-31,2016-10-23,"Cat5",52,52,62,NA,NA
"25566-ORDEQ","Hemlock Creek  downstream of NFS Road 5830",43.36094255,-121.8293457,"OR_WS_170703020102_05_102334","River/Stream","Year round","Deschutes",2016-05-08,2016-10-23,"Cat5",120,120,92,NA,NA
"25726-ORDEQ","Fish Creek below Slipper Creek, North Umpqua River",43.23041942,-122.4473754,"OR_WS_171003010404_02_105643","River/Stream","Year round","Umpqua",2009-09-07,2009-10-14,"Cat5",15,15,17,NA,NA
"25858-ORDEQ","Morten Creek downstream of Wallers",42.94624312,-124.4478033,"OR_WS_171003060104_02_106331","River/Stream","Year round","South Coast",2008-09-04,2017-08-16,"Cat5",69,62,88,NA,NA
"27847-ORDEQ","Fate Creek",42.99964329,-123.1029484,"OR_WS_171003020505_02_105697","River/Stream","Year round","Umpqua",2014-06-26,2014-09-14,"Cat2",0,0,76,NA,NA
"28076-ORDEQ","Powder Creek",45.25198941,-123.6588165,"OR_WS_171002030206_05_106105","River/Stream","Year round","North Coast",2009-07-06,2009-09-20,"Cat5",23,23,77,NA,NA
"28284-ORDEQ","Jack Creek above bridge 1 mile above golfcourse (Chetco River)",42.03988568,-124.197198,"OR_WS_171003120111_02_104697","River/Stream","Year round","South Coast",2008-07-06,2008-10-19,"Cat2",0,0,65,NA,NA
"28284-ORDEQ","Jack Creek above bridge 1 mile above golfcourse (Chetco River)",42.03988568,-124.197198,"OR_WS_171003120111_02_104697","River/Stream","Spawn","South Coast",2008-10-15,2008-10-19,"Cat2",NA,NA,NA,0,0
"28306-ORDEQ","East Fork Edson Creek near mouth (Rogue River below Lobster Creek)",42.4806,-124.3926,"OR_WS_171003100803_02_104698","River/Stream","Year round","Rogue",2016-06-28,2016-09-26,"Cat2",0,0,88,NA,NA
"28386-ORDEQ","Euchre: Pea Creek at mouth",42.56376386,-124.3588059,"OR_WS_171003060403_02_104675","River/Stream","Year round","South Coast",2009-06-18,2016-07-25,"Cat2",0,0,75,NA,NA
"28728-ORDEQ","Johnson Creek at SE 327th Avenue",45.46049274,-122.3263697,"OR_WS_170900120101_02_104550","River/Stream","Year round","Willamette",2014-06-11,2015-10-26,"Cat5",140,140,184,NA,NA
"28729-ORDEQ","Johnson Creek at Revenue Road",45.46174295,-122.3368358,"OR_WS_170900120101_02_104550","River/Stream","Year round","Willamette",2011-08-11,2011-10-03,"Cat5",15,15,51,NA,NA
"28964-ORDEQ","Clark Creek at mouth (tributary to Pringle Creek at River Mile 1.05)",44.92694513,-123.0331353,"OR_WS_170900070301_02_104413","River/Stream","Year round","Willamette",2008-01-01,2009-04-19,"Cat5",49,49,71,NA,NA
"28975-ORDEQ","Fifteenmile Creek upstream of Underhill's Diversion",45.43913809,-121.1860371,"OR_WS_170701050302_02_101985","River/Stream","Year round","Hood",2008-04-07,2008-10-21,"Cat5",74,74,92,NA,NA
"28975-ORDEQ","Fifteenmile Creek upstream of Underhill's Diversion",45.43913809,-121.1860371,"OR_WS_170701050302_02_101985","River/Stream","Spawn","Hood",2008-04-07,2008-10-21,"Cat5",NA,NA,NA,53,53
"28976-ORDEQ","Fifteenmile Creek upstream of Ramsey Creek",45.4309174,-121.2249578,"OR_WS_170701050301_02_101984","River/Stream","Year round","Hood",2008-04-07,2008-10-21,"Cat5",49,49,92,NA,NA
"28976-ORDEQ","Fifteenmile Creek upstream of Ramsey Creek",45.4309174,-121.2249578,"OR_WS_170701050301_02_101984","River/Stream","Spawn","Hood",2008-04-07,2008-10-21,"Cat5",NA,NA,NA,40,40
"28977-ORDEQ","Fifteenmile Creek at Dufur City Reservoir intake",45.39582049,-121.2786149,"OR_WS_170701050301_02_101984","River/Stream","Year round","Hood",2008-04-07,2008-10-21,"Cat5",10,10,92,NA,NA
"28977-ORDEQ","Fifteenmile Creek at Dufur City Reservoir intake",45.39582049,-121.2786149,"OR_WS_170701050301_02_101984","River/Stream","Spawn","Hood",2008-04-07,2008-10-21,"Cat5",NA,NA,NA,27,27
"28979-ORDEQ","Eightmile Creek upstream of Fivemile Creek",45.59265626,-121.0800969,"OR_WS_170701050204_02_101983","River/Stream","Year round","Hood",2008-04-07,2008-10-21,"Cat5",61,61,92,NA,NA
"28979-ORDEQ","Eightmile Creek upstream of Fivemile Creek",45.59265626,-121.0800969,"OR_WS_170701050204_02_101983","River/Stream","Spawn","Hood",2008-04-07,2008-05-15,"Cat3B",NA,NA,NA,1,1
"28980-ORDEQ","Eightmile Creek at Highway 197",45.529513,-121.0925094,"OR_WS_170701050204_02_101983","River/Stream","Year round","Hood",2008-04-07,2008-06-11,"Cat3",0,0,0,NA,NA
"28980-ORDEQ","Eightmile Creek at Highway 197",45.529513,-121.0925094,"OR_WS_170701050204_02_101983","River/Stream","Spawn","Hood",2008-04-07,2008-05-14,"Cat2",NA,NA,NA,0,0
"29406-ORDEQ","Deschutes River at Pringle Fall Experiment Station",43.74013573,-121.6066698,"OR_WS_170703010301_05_102282","River/Stream","Year round","Deschutes",2017-05-15,2017-10-16,"Cat2",0,0,72,NA,NA
"29540-ORDEQ","Morton Creek at 101",42.94252697,-124.4446383,"OR_WS_171003060104_02_106331","River/Stream","Year round","South Coast",2008-07-05,2017-08-16,"Cat5",94,64,88,NA,NA
"29563-ORDEQ","Boulder Creek near mouth",42.56358947,-124.3484086,"OR_WS_171003060403_02_104675","River/Stream","Year round","South Coast",2016-06-27,2016-08-11,"Cat2",0,0,42,NA,NA
"29596-ORDEQ","Crook Creek at cattle bridge",42.27597113,-124.3943263,"OR_WS_171003120404_02_104696","River/Stream","Year round","South Coast",2009-06-18,2009-08-06,"Cat5",25,25,37,NA,NA
"29627-ORDEQ","Jack Creek above golf course",42.03944912,-124.1867076,"OR_WS_171003120111_02_104697","River/Stream","Year round","South Coast",2008-07-06,2008-10-19,"Cat5",4,4,87,NA,NA
"29627-ORDEQ","Jack Creek above golf course",42.03944912,-124.1867076,"OR_WS_171003120111_02_104697","River/Stream","Spawn","South Coast",2008-10-15,2008-10-19,"Cat2",NA,NA,NA,0,0
"29697-ORDEQ","Edson Creek, above bridge #256",42.4747724,-124.3902949,"OR_WS_171003100803_02_104698","River/Stream","Year round","Rogue",2016-06-28,2016-09-26,"Cat2",0,0,88,NA,NA
"31694-ORDEQ","Newton Creek at mouth, NW Jefferson Street, Roseburg, OR",43.22553131,-123.3819415,"OR_WS_171003021305_02_105321","River/Stream","Year round","Umpqua",2016-06-08,2017-10-04,"Cat5",181,181,173,NA,NA
"32054-ORDEQ","Drift Creek at Victor Point Road",44.92407374,-122.7562004,"OR_WS_170900090102_02_104455","River/Stream","Year round","Willamette",2008-12-10,2009-05-06,"Cat3",0,0,0,NA,NA
"32054-ORDEQ","Drift Creek at Victor Point Road",44.92407374,-122.7562004,"OR_WS_170900090102_02_104455","River/Stream","Spawn","Willamette",2008-12-10,2009-05-06,"Cat2",NA,NA,NA,0,0
"32462-ORDEQ","West Fork Neal Creek above EFID main canal inflow",45.584174,-121.5281168,"OR_WS_170701050701_02_102005","River/Stream","Year round","Hood",2009-06-11,2011-11-08,"Cat2",0,0,276,NA,NA
"32462-ORDEQ","West Fork Neal Creek above EFID main canal inflow",45.584174,-121.5281168,"OR_WS_170701050701_02_102005","River/Stream","Spawn","Hood",2010-04-13,2011-05-15,"Cat2",NA,NA,NA,0,0
"32463-ORDEQ","EF Irrigation District Main Canal at Base ",45.58542885,-121.5294327,"OR_WS_170701050701_02_102005","Canal Transport","Year round","Hood",2009-06-12,2011-11-08,"Cat5",2,2,275,NA,NA
"32464-ORDEQ","West Fork Neal Creek below EFID main canal",45.58624653,-121.5255164,"OR_WS_170701050701_02_102005","River/Stream","Year round","Hood",2009-06-11,2011-11-08,"Cat2",0,0,184,NA,NA
"32464-ORDEQ","West Fork Neal Creek below EFID main canal",45.58624653,-121.5255164,"OR_WS_170701050701_02_102005","River/Stream","Spawn","Hood",2011-04-27,2011-05-15,"Cat2",NA,NA,NA,0,0
"32468-ORDEQ","Neal Creek below east/west confluence",45.59955496,-121.5015614,"OR_WS_170701050701_02_102005","River/Stream","Year round","Hood",2009-06-11,2011-11-08,"Cat2",0,0,276,NA,NA
"32468-ORDEQ","Neal Creek below east/west confluence",45.59955496,-121.5015614,"OR_WS_170701050701_02_102005","River/Stream","Spawn","Hood",2010-04-12,2011-11-08,"Cat2",NA,NA,NA,0,0
"32640-ORDEQ","Butte Creek at Hwy 101 (New River)",42.9575901,-124.435149,"OR_WS_171003060104_02_106331","River/Stream","Year round","South Coast",2008-07-05,2008-10-02,"Cat2",0,0,88,NA,NA
"32641-ORDEQ","Crook Creek at North Bank Bridge (Pistol River)",42.27672438,-124.3932182,"OR_WS_171003120404_02_104696","River/Stream","Year round","South Coast",2009-06-19,2009-09-13,"Cat5",11,11,75,NA,NA
"32653-ORDEQ","Turnbow Creek at High Pass Road, RM 0.88 (Owens Creek, Bear Creek, Long Tom R., Upper Willamette)",44.22314755,-123.345699,"OR_WS_170900030109_02_104251","River/Stream","Year round","Willamette",2017-07-24,2017-10-26,"Cat5",51,51,69,NA,NA
"32666-ORDEQ","Crook Creek at Pistol River Loop Road (Pistol River)",42.27590917,-124.3947004,"OR_WS_171003120404_02_104696","River/Stream","Year round","South Coast",2009-06-18,2009-09-13,"Cat5",47,47,75,NA,NA
"32808-ORDEQ","Walla Walla River, North Fork near mouth (River Mile 0.4)",45.90038943,-118.297166,"OR_WS_170701020104_16_101866","River/Stream","Year round","Umatilla",2008-06-23,2017-10-19,"Cat5",1307,492,274,NA,NA
"33252-ORDEQ","Weaver Creek at Hidden Homestead Road near mouth (South Myrtle, South Umpqua)",43.0522738,-123.0674572,"OR_WS_171003021001_02_105703","River/Stream","Year round","Umpqua",2011-07-03,2011-10-23,"Cat2",0,0,90,NA,NA
"33252-ORDEQ","Weaver Creek at Hidden Homestead Road near mouth (South Myrtle, South Umpqua)",43.0522738,-123.0674572,"OR_WS_171003021001_02_105703","River/Stream","Spawn","Umpqua",2011-10-15,2011-10-23,"Cat2",NA,NA,NA,0,0
"33312-ORDEQ","Little Muddy CR at RM 0.5 (ODFW)",45.96888484,-123.9411941,"OR_WS_171002010103_05_106209","River/Stream","Year round","North Coast",2009-07-06,2009-09-21,"Cat2",0,0,78,NA,NA
"33319-ORDEQ","Rogers Creek (ODFW)",44.15865198,-123.8858697,"OR_WS_171002060501_02_106168","River/Stream","Year round","Mid Coast",2009-07-01,2009-08-31,"Cat5",40,40,62,NA,NA
"33357-ORDEQ","Mill CR N FK at RM 0.08 (Middle Siletz R, ODFW)",44.76702637,-123.758735,"OR_WS_171002040502_02_106182","River/Stream","Year round","Mid Coast",2009-07-28,2009-09-16,"Cat5",14,14,51,NA,NA
"33374-ORDEQ","Fourmile Creek 2 (ODFW)",42.9864926,-124.3320658,"OR_WS_171003060105_02_106330","River/Stream","Year round","South Coast",2009-07-07,2009-09-08,"Cat5",21,21,64,NA,NA
"33419-ORDEQ","Billy Moore Creek (ODFW)",43.887241,-123.9711157,"OR_WS_171002070102_02_106386","River/Stream","Year round","Mid Coast",2009-07-23,2009-10-11,"Cat2",0,0,70,NA,NA
"33452-ORDEQ","Clear Creek (ODFW)",42.79553171,-123.2452889,"OR_WS_171003020702_02_106348","River/Stream","Year round","Umpqua",2009-07-20,2009-08-31,"Cat5",43,43,43,NA,NA
"33461-ORDEQ","Rock Creek East Fork (ODFW)",43.38072288,-122.8285913,"OR_WS_171003010902_02_105664","River/Stream","Year round","Umpqua",2009-07-14,2009-08-13,"Cat5",8,8,31,NA,NA
"33603-ORDEQ","Neal Creek at Fir Mountain Road",45.6387919,-121.5134566,"OR_WS_170701050701_02_102005","River/Stream","Year round","Hood",2009-06-11,2011-11-08,"Cat5",10,10,276,NA,NA
"33603-ORDEQ","Neal Creek at Fir Mountain Road",45.6387919,-121.5134566,"OR_WS_170701050701_02_102005","River/Stream","Spawn","Hood",2010-04-12,2011-11-08,"Cat2",NA,NA,NA,0,0
"33915-ORDEQ","Maxfield Creek at River Mile 2.6 at Maxfield Creek Road (Luckiamute, Willamette)",44.69877746,-123.3920923,"OR_WS_170900030503_02_104277","River/Stream","Year round","Willamette",2017-06-06,2017-10-10,"Cat5",41,41,92,NA,NA
"34063-ORDEQ","Reed Creek Below Coquille WA restoration project (Middle Fork Coquille)",43.03537035,-123.7009561,"OR_WS_171003050101_02_105309","River/Stream","Year round","South Coast",2008-06-15,2008-08-19,"Cat5",50,50,50,NA,NA
"34064-ORDEQ","Reed Creek Above Coquille WA restoration project (Middle Fork Coquille)",43.03674894,-123.7016521,"OR_WS_171003050101_02_105309","River/Stream","Year round","South Coast",2008-06-15,2008-08-19,"Cat5",51,51,50,NA,NA
"34124-ORDEQ","Louis Creek at South Myrtle Creek Road (S. Myrtle, Umpqua)",43.03553293,-123.1484183,"OR_WS_171003021001_02_105703","River/Stream","Year round","Umpqua",2011-07-03,2011-10-23,"Cat5",25,25,90,NA,NA
"34124-ORDEQ","Louis Creek at South Myrtle Creek Road (S. Myrtle, Umpqua)",43.03553293,-123.1484183,"OR_WS_171003021001_02_105703","River/Stream","Spawn","Umpqua",2011-10-15,2011-10-23,"Cat5",NA,NA,NA,3,3
"34299-ORDEQ","Pea Creek 140m DS of Euchre Cr Rd culver (Euchre)",42.56562695,-124.3596372,"OR_WS_171003060403_02_104675","River/Stream","Year round","South Coast",2009-06-18,2009-09-13,"Cat2",0,0,75,NA,NA
"34300-ORDEQ","Pea Creek 40m DS of Euchre Cr Rd culvert (Euchre)",42.56657502,-124.3599364,"OR_WS_171003060403_02_104675","River/Stream","Year round","South Coast",2009-06-18,2009-08-06,"Cat2",0,0,37,NA,NA
"34301-ORDEQ","Pea Creek 30m US of Euchre Cr Rd culvert (Euchre)",42.56749611,-124.3603067,"OR_WS_171003060403_02_104675","River/Stream","Year round","South Coast",2009-06-18,2009-09-13,"Cat2",0,0,75,NA,NA
"34319-ORDEQ","Morten Creek at RM 1.2 (New River)",42.94694919,-124.4491671,"OR_WS_171003060104_02_106331","River/Stream","Year round","South Coast",2008-07-05,2008-10-02,"Cat5",19,19,88,NA,NA
"34322-ORDEQ","Crowley Cr at RM 0.72",45.04862073,-123.9856192,"OR_WS_171002040803_02_106178","River/Stream","Year round","Mid Coast",2009-07-30,2009-09-16,"Cat2",0,0,49,NA,NA
"34323-ORDEQ","Beaver Cr NF Trib G (NF Beaver at RM 6.38) at RM 1.08",44.53429873,-123.9262446,"OR_WS_171002050501_02_106160","River/Stream","Year round","Mid Coast",2009-07-29,2009-09-29,"Cat2",0,0,63,NA,NA
"34325-ORDEQ","Steel Cr at RM 0.14",43.15859453,-123.9621837,"OR_WS_171003050306_02_106393","River/Stream","Year round","South Coast",2009-07-07,2009-09-14,"Cat5",61,61,70,NA,NA
"34328-ORDEQ","Willow Creek at RM 4.3 (Floras)",42.87743965,-124.4275128,"OR_WS_171003060102_02_104668","River/Stream","Year round","South Coast",2009-07-03,2009-09-10,"Cat2",0,0,70,NA,NA
"34627-ORDEQ","Lousignont Cr at RM 1.06 US of NF Lousignont Cr",45.74294322,-123.303611,"OR_WS_171002020101_05_106443","River/Stream","Year round","North Coast",2008-04-11,2017-07-11,"Cat5",331,170,267,NA,NA
"34627-ORDEQ","Lousignont Cr at RM 1.06 US of NF Lousignont Cr",45.74294322,-123.303611,"OR_WS_171002020101_05_106443","River/Stream","Spawn","North Coast",2008-04-11,2016-10-05,"Cat5",NA,NA,NA,215,105
"34688-ORDEQ","Johnson Cr at RM 6.0",43.52660792,-124.0486055,"OR_WS_171003040402_02_105002","River/Stream","Year round","South Coast",2014-07-28,2014-09-28,"Cat2",0,0,63,NA,NA
"35208-ORDEQ","Lousignont Creek Below State Forest Boundary at RM 1.6 (Nehalem)",45.73563423,-123.3061633,"OR_WS_171002020101_05_106443","River/Stream","Year round","North Coast",2008-04-11,2017-07-15,"Cat5",301,160,228,NA,NA
"35208-ORDEQ","Lousignont Creek Below State Forest Boundary at RM 1.6 (Nehalem)",45.73563423,-123.3061633,"OR_WS_171002020101_05_106443","River/Stream","Spawn","North Coast",2008-04-11,2016-09-23,"Cat5",NA,NA,NA,225,112
"35209-ORDEQ","Lousignont Cr Trib (Approx. RM 1.2) T3N R5W SESE Sec 16 (Nehalem)",45.74419974,-123.3067923,"OR_WS_171002020101_05_106443","River/Stream","Year round","North Coast",2008-04-11,2008-12-08,"Cat2",0,0,92,NA,NA
"35209-ORDEQ","Lousignont Cr Trib (Approx. RM 1.2) T3N R5W SESE Sec 16 (Nehalem)",45.74419974,-123.3067923,"OR_WS_171002020101_05_106443","River/Stream","Spawn","North Coast",2008-04-11,2008-12-08,"Cat2",NA,NA,NA,0,0
"35210-ORDEQ","Lousignont Cr Trib Pond (Approx. RM 1.5) T3N R5W NWSE Sec 16 (Nehalem)",45.7446228,-123.3099272,"OR_WS_171002020101_05_106443","River/Stream","Year round","North Coast",2008-04-11,2008-09-30,"Cat5",70,70,92,NA,NA
"35210-ORDEQ","Lousignont Cr Trib Pond (Approx. RM 1.5) T3N R5W NWSE Sec 16 (Nehalem)",45.7446228,-123.3099272,"OR_WS_171002020101_05_106443","River/Stream","Spawn","North Coast",2008-04-11,2008-05-14,"Cat2",NA,NA,NA,0,0
"35211-ORDEQ","Kuder Cr below Schmadeke Reservoir (Dairy, Rock, Tualatin)",45.66485173,-123.1809125,"OR_WS_170900100302_02_104499","River/Stream","Year round","Willamette",2008-04-11,2017-10-12,"Cat5",2,2,276,NA,NA
"35212-ORDEQ","Kuder Cr Trib Pond near NW Way Rd T2N R4W SESE Sec 9 (Dairy, Rock, Tualatin)",45.66592124,-123.1786164,"OR_WS_170900100302_02_104499","River/Stream","Year round","Willamette",2008-04-11,2008-10-23,"Cat5",7,7,74,NA,NA
"35214-ORDEQ","Tualatin River Drainage at T2S R4W SENW Sec 6",45.42870388,-123.2303372,"OR_WS_170900100204_02_104495","River/Stream","Year round","Willamette",2008-04-11,2008-10-06,"Cat2",0,0,92,NA,NA
"35216-ORDEQ","Tualatin River Drainage Pond near Cherry Grove T1S R4W NESW Sec 31",45.43844129,-123.2328009,"OR_WS_170900100204_02_104495","River/Stream","Year round","Willamette",2008-04-11,2008-04-28,"Cat3",0,0,0,NA,NA
"35267-ORDEQ","Paul Creek 1.2RM u/s of Riddle Creek(Donner und Blitzen River)",43.07510712,-118.5425414,"OR_WS_171200010601_05_106529","River/Stream","Year round","Malheur Lake",2008-04-29,2008-09-15,"Cat5",68,68,77,NA,NA
"35268-ORDEQ","Paul Creek 5.2RM u/s of Riddle Creek(Donner und Blitzen River)",43.0730101,-118.470479,"OR_WS_171200010601_05_106529","River/Stream","Year round","Malheur Lake",2008-05-02,2008-09-15,"Cat5",77,77,77,NA,NA
"35270-ORDEQ","Coffeepot Creek at RM 4.9(Malheur Lake)",43.71440593,-118.8279456,"OR_WS_171200010104_05_106513","River/Stream","Year round","Malheur Lake",2008-05-06,2008-09-07,"Cat5",15,15,69,NA,NA
"35271-ORDEQ","Krumbo Creek 0.5mi u/s of Krumbo Reservoir(Donner und Blitzen River)",42.94485838,-118.7863682,"OR_WS_171200030205_05_106597","River/Stream","Year round","Malheur Lake",2008-05-05,2008-09-30,"Cat5",42,42,92,NA,NA
"35272-ORDEQ","Landing Creek 1.0RM u/s of Silvies River",43.77871007,-119.1789589,"OR_WS_171200020404_05_106566","River/Stream","Year round","Malheur Lake",2008-06-09,2008-09-17,"Cat2",0,0,79,NA,NA
"35274-ORDEQ","Muddy Creek 5.6RM u/s of Malheur River",43.88391826,-118.677022,"OR_WS_170501160502_05_102989","River/Stream","Year round","Malheur",2008-05-09,2008-09-08,"Cat5",68,68,70,NA,NA
"35316-ORDEQ","Little Deschutes River d/s of Gilchrist Pond & Sawmill Rd.",43.47744002,-121.6895361,"OR_WS_170703020106_05_102338","River/Stream","Year round","Deschutes",2016-07-31,2016-10-23,"Cat5",36,36,62,NA,NA
"35387-ORDEQ","Whychus Creek at Road 4606 footbridge",44.27362701,-121.5548191,"OR_WS_170703010702_05_102298","River/Stream","Year round","Deschutes",2014-03-30,2017-10-15,"Cat2",0,0,93,NA,NA
"35389-ORDEQ","Whychus Creek at city park in Sisters, OR",44.28836,-121.54182,"OR_WS_170703010702_05_102298","River/Stream","Year round","Deschutes",2014-03-30,2017-10-15,"Cat2",0,0,92,NA,NA
"35587-ORDEQ","Battle Creek at RM 3.64",44.86022359,-123.0169234,"OR_WS_170900070203_02_104411","River/Stream","Year round","Willamette",2008-10-27,2009-04-07,"Cat3",0,0,0,NA,NA
"35933-ORDEQ","Battle Creek above Jory Creek",44.86095919,-123.0487604,"OR_WS_170900070203_02_104411","River/Stream","Year round","Willamette",2008-10-28,2009-04-07,"Cat3",0,0,0,NA,NA
"36630-ORDEQ","Butte Creek NR Mouth",42.95768613,-124.4602304,"OR_WS_171003060104_02_106331","River/Stream","Year round","South Coast",2008-07-05,2008-10-02,"Cat2",0,0,88,NA,NA
